subreddit,poster,post,response,model_generated,empower,reasons,stance,ambiguity,empower_all
CasualConversation,woman,"I dont know if this is just a factor of my age or what, but when I hang out with my friends, we usually put the kids to bed upstairs then try to stay as quiet as possible downstairs while we drink tea, coffee, and/or alcohol and talk to each other. We occasionally have large gatherings with explicit purpose like baking cookies together or friendsgiving/friendsmas dinner, but otherwise the main activity is generally sitting on our butts, relaxing, and enjoying conversation. (My social circle is in 30s to early 40s.)","That sounds awesome!  I am in my middle 20s and I already see a lot of my friends getting married and starting families.  My friend group is very tight knit, and I still share a house with 4 of my best friends, but my girlfriend and I want to live together eventually and I know our group dynamics will change.  I hope I can still maintain a healthy group of friends who still make time for each other when we all have families like you all do!",False,neutral,[],agree,no,"['neutral', 'neutral', 'neutral']"
relationships,woman,"I dont know the details of your job, so obviously I cant suggest anything concrete, but maybe theres another employment solution for both of you - is there a way to do similar things in a static location for you both?","Yeah, I suppose. But there is a reason we both work for the same peoplewe both love the work and all it affords us (travel opportunities, etc). We have a 5-year contract were both 1 year into though, so any planning to try a more static job on for size would have to be awfully long-term...",True,empowering,"['decision', 'options']",agree,no,"['neutral', 'empowering', 'empowering']"
teenagers,woman,"I dont know where Im supposed to find this image NINEJNCAPITALJYFQDOTPNG.   imgur.com/9jnJyfq.png  Currently removed now, thought I had the right URL earlier but I guess not.   I guess this is a dead end if I cant see that picture. ","oh yeah, the image was removed    heres a mirror of the image, morse code is on top",False,empowering,[],agree,no,"['neutral', 'empowering', 'empowering']"
teenagers,woman,"I dont like it much either, but go with the flow. Or smash into all the rocks in the river, if thats what you want ",Im one to go with the flow but Im starting to break away from that. I guess Ill make an exception ;p and I try to enjoy nature more than try to destroy it :b Ill make one right now,False,empowering,"['decision', 'options']",agree,no,"['empowering', 'empowering', 'empowering']"
CasualConversation,woman,"I dont like porn, soz kiddo not mine    Also pretend me would still not kick any son out. Or discriminate against a sexual identity. What kid of a pretend mother do you think i am? I am hurt.","Im a girl, mom :( ",False,disempowering,[],disagree,no,"['neutral', 'disempowering', 'disempowering']"
CasualConversation,man,"I dont like unreliable co-workers, its frustrating to have to do more work just because they were sick or something",These people are the worst. I find when i am genuinely sick they try to portray themselves in worse shape than me. I just want to be left alone.,False,disempowering,['changes'],agree,no,"['empowering', 'disempowering', 'disempowering']"
relationships,woman,"I dont see how that matters.   Hes not owed sex within a time frame, nor is she obligated to keep everyone to the same time frame as the first.   She probably wanted a more emotional investment from OP, then during the break up just wanted a fling without attachment. I dont see why everyone is pointing to this as evidence that shes a terrible person. ","It matters. Maybe in a perfect world it wouldnt matter, but it matters.",False,disempowering,['rights'],disagree,no,"['disempowering', 'disempowering', 'empowering']"
Fitness,man,"I dont think I could squat and dead lift in 30 minutes honestly. Might work for a while but youre going to need some nice warm up and rest once you start progressing. If you can finish that, good for you.",And on the same day? I tend to do deadlift on back day. Squat and deadlift are both such hefty exhausting lifts I gotta separate em.,True,empowering,['competency'],agree,no,"['empowering', 'empowering', 'empowering']"
Fitness,man,"I dont think the people hes telling that to have any idea of how hard 4:15 is to get. Honestly, if he said that he ran say, 4:55 or 5:10 Id actually be more impressed, just because I wouldnt think that he was full of shit.","Right,  I just looked up what Ashton Eaton, who holds the highest decathlon score, and he has gotten only a 4:15 1500m.  I could believe it if it was much younger but it is probably greatly exaggerated with his current body build.",False,No Consensus,[],agree,no,"['neutral', 'empowering', 'disempowering']"
Fitness,man,"I dont think this happens as much with personal progress posts as it does when people are trying to sell something.  There are typically factors other than fitness progress that make the After picture more impressive (lifting weights seems to have a strong correlation with tanning and shaving), but I suspect this kind of deliberate manipulation is rare outside of advertising.",Thats a good point I didnt think about advertising. I think I was just being cynical thinking everyones a karma whore haha.,False,No Consensus,[],agree,yes,"['neutral', 'empowering', 'disempowering']"
Fitness,man,"I dont think unsolicited advice is a big no-no, but unless its a serious problem that could result in injury - such as a rounded back deadlift - people who think they know better might not appreciate it just because their quarter squat is heavier than your ATG squat so they think they know better.  ","I quarter-squat 4x my BW... what about you, bro?",False,No Consensus,"['critically', 'true']",neutral,no,"['empowering', 'neutral', 'disempowering']"
teenagers,man,"I doubt I will. My dad said he always looked younger than he was, which makes it sound hopeless.","Looking young is not a bad thing man. I know a lot of girls who dig that shit. Like I said, rock that baby face proud and trust me, all will be good. It certainly is better than me, Im 17 and look like Im in my 20s lol",False,disempowering,['emotion'],disagree,no,"['neutral', 'disempowering', 'disempowering']"
Fitness,man,I drink whey mixed in milk for my post workout. Muscle milk costs more per serving than the straight whey and milk combination.,"Im pretty sure muscle milk doesnt contain any actually milk, contrary to the name of the drink.",False,neutral,[],neutral,no,"['neutral', 'neutral', 'neutral']"
CasualConversation,woman,"I drive a red 1981 Austin Mini! Heres a picture along with my mom and dads pink and yellow Minis (1983 Morris and 1971 Austin). Apologies for the horrific color balance, I took this from my local newspapers website. <link>",Thats pretty bitchin!,False,neutral,[],agree,no,"['neutral', 'empowering', 'neutral']"
relationships,man,"I dunno. Not everyone goes to the therapist for the same thing. I wonder if that type of content could be a distraction, either in the office or the waiting area. It definitely has its place, and is relevant to work with relationships; but I wonder if it hanging around, where many different people are going to discuss differing and difficult things, will have as ubiquitous an effect as we would hope or expect it to.","Was kind of exaggerating, but good point!",False,No Consensus,['emotion'],No Consensus,no,"['empowering', 'disempowering', 'neutral']"
AskReddit,man,"I envy you. My wifes mom is the same as yours, perfect. I get to call her mom, so I got that going for me which is nice","Confide in her then instead of your birth mother, itll all be well :D",True,empowering,[],agree,No Consensus,"['empowering', 'empowering', 'empowering', 'neutral']"
relationships,woman,"I feel for you OP. I have a pretty bad anxiety disorder myself and cant imagine how it feels to go through that without a supportive partner. My family (particularly my dad) are very much the same mentality as your husband, but thankfully my fiance is much more understanding. I think youre right to seek help as its an awful thing to go through alone, and I wish you all the best in getting help with it <3","Thank you. I have been feeling alone in this, even my family has the same views. I think its because of this that I have been clinging on to his approval.",True,empowering,[],agree,no,"['empowering', 'empowering', 'empowering']"
Fitness,woman,"I feel like I am winning at life when I read this and have no strong emotions either way.    This signifies that sugar or the absence thereof is no longer constantly on my mind - a huge victory when I consider the fact that I used to not be able to go to the convenience store without spending half an hour frantically talking myself out of buying candy.  Yep, a balanced diet without hard rules aside from eat vegetables and eat protein and fat is pretty great.","Same here, sugar actually almost has a negative effect on me. I find it takes pleasure  away from other foods by masking their taste..  Salt however .. give me a salt lick and call me a cow. Actually not that bad, but I do like a bit of it  Edit.. for clarity",True,empowering,['changes'],agree,no,"['empowering', 'neutral', 'empowering']"
teenagers,woman,I feel like I missed something...,"/u/cucumberslut deleted her account cos she was being harassed. At least, thats what Ive heard :)",False,neutral,[],neutral,no,"['neutral', 'neutral', 'neutral']"
Fitness,man,"I feel like I owe this nice resolution to the kind people of this sub, wow , really gave me an eye opener about body-weight-fitness while I also received some great advice about how to handle the situation very maturely.   For those of you who roam this sub just to help people. You deserve A BIG thank you. You guys are awesome! ","> kind people of this sub  Well thats a first. Can I get this framed? /r/Fitness was called kind on July 4th, 2014.  ",True,empowering,"['competency', 'emotion']",disagree,no,"['empowering', 'empowering', 'empowering']"
AskReddit,woman,I feel like pop ups are less annoying now that literally every browser seems to block them effortlessly. The ones which pretend to be a download button or similar or which appear right in the place you were about to click annoy me more.,Ads like that make me very thankful for ad block.,False,neutral,[],neutral,no,"['neutral', 'neutral', 'neutral']"
relationships,woman,"I feel like that covers such a good spectrum of people to get advice from that you know this is the right choice! Trust the people who know you, and focus on all the happy things that are coming your way (like the wedding!) instead of the toxicness.","The wedding already happened, but I agree with you, sounds like not responding is the right choice. ",True,empowering,"['decision', 'positive']",agree,yes,"['empowering', 'empowering', 'empowering']"
teenagers,woman,"I feel like you complain too much about exercise all the time. have you seen any results? Thats the shit that keeps me going, tbh I have a good metabolism right now so Im not that crazy about always getting a good workout in, but I eat pretty well so that helps.","Aside from being sore and tired all the time, no.",True,disempowering,[],No Consensus,yes,"['disempowering', 'disempowering', 'empowering']"
relationships,man,"I feel like your mom cant pick up your medicine without you, thats a serious breach of interest, right?  Doesnt matter if youre on her insurance, its prescribed to you....  Call the police and ask.  Better yet, call the pharmacy and ask. ","Im going to get in touch with my doctor and the pharmacist, maybe even Hazelden if I can to see what to do. Im not at all trying to get my parents in legal trouble for this because they dont deserve that at all, but Ill definitely check up with some medical professionals! ",False,empowering,"['decision', 'rights']",agree,no,"['empowering', 'empowering', 'empowering']"
Fitness,man,"I fell in love with deadlift the first time I did it, I love everything about them. Just make sure you have good form for it.",Definitely am. I met an older dude at the gym who has taken me under his wing and helping me with deadlifts and squats. Got pretty lucky,True,empowering,['emotion'],agree,no,"['empowering', 'neutral', 'empowering']"
CasualConversation,man,"I figured id either get fired, have a talking to...or nothing.  so far, boss asked me if i was happy the other day, bells went off in my head...but nothing much beyond that. He probably is laughing his ass off if he heard me though.  If anything was going to happen it would have happened already.",Oh shit thats good.,False,neutral,[],agree,no,"['neutral', 'empowering', 'neutral']"
CasualConversation,woman,"I fix computers when people ask, and they either get tired of their crappy computer and buy a new one and ask me to erase the stuff from their old one (and sometimes they just give me the old one) or you see random parts and such on eBay for a good price.",Good to know. Ill have to do some research on parts and such.,False,neutral,[],neutral,no,"['neutral', 'neutral', 'neutral']"
Fitness,woman,I gave him 4 high fives because the first 3 didnt really work. And he is super cool =) you sound cool too!,"Haha yay, and thank you! :]",True,empowering,['positive'],agree,no,"['empowering', 'empowering', 'empowering']"
teenagers,woman,"I got the complete edition during steam sale. Ive tried, but think Im bad at it so I dont like it so much right now. Enlighten me?",Yeah sure thing. I can give you some tips if we play sometime!,False,disempowering,[],neutral,no,"['disempowering', 'neutral', 'disempowering']"
CasualConversation,man,"I got them last year, and just finished reading them a few months ago. They are tough to read, but the world and the characters are worth it! :)",Ugh theyre so awful. I knew he killed off a lot of characters...but I wasnt prepared.,True,neutral,[],No Consensus,no,"['empowering', 'neutral', 'neutral']"
teenagers,man,I guess my brain just subconciously added the I. Sorry about that.,I thought it was funny.,False,neutral,[],neutral,no,"['empowering', 'neutral', 'neutral']"
teenagers,man,"I guess what Im trying to say is, work on your relationship with your parents, thats so important.",People under the age of 18 dont understand that. I sure as hell didnt.,True,empowering,['critically'],agree,no,"['empowering', 'empowering', 'empowering']"
AskReddit,woman,I guessed the twist simply because I knew there was one. There was a part where he promises his daughter hell take her to the zoo but he was going to be busy that day. I was wondering why hed lie to his ppoor kid so I guessed he had a twin and voila its true!,"Well there are two huge twists in the prestige, I was talking more about the other one that you dont really find out about til the very end",False,disempowering,['critically'],No Consensus,no,"['neutral', 'disempowering', 'disempowering']"
teenagers,woman,"I had a main account and an alt (this account), but a friend found my main and gave it out to people (despite having some deep, personal shit on there). Its still up, I just dont bother with it, so I switched to this one.","People know my main, so occasionally I go through and see if there is anything I should delete. Just in case.",False,neutral,[],neutral,no,"['neutral', 'neutral', 'neutral']"
teenagers,man,I hate you all and your happiness.,I love *you*.,False,disempowering,['emotion'],neutral,yes,"['neutral', 'disempowering', 'disempowering']"
Fitness,woman,"I have Nike Free 5.0s and have bought a pair each year for three years. Im a dog walker, I also run them so Im on my feet for 7-9 hours a day straight. I recommend them highly. ","> Nike Free 5.0  Interesting, Im pretty sure thats what I wear now. Its funny, Ive honestly never had problems with them but everyone I talk to about shoes preaches to me about how bad Nikes are for running. They never really have anything to back it up though",True,empowering,[],neutral,no,"['empowering', 'neutral', 'empowering']"
teenagers,man,I have a Dodge Challenger and I also have a YZ250F.,You bastard. You are me with money. How did you get a challenger? And I hope its not a V6,False,neutral,[],neutral,no,"['neutral', 'neutral', 'neutral']"
relationships,woman,"I have a Moto G, and what I do is:  - Go to Contacts  - Select the persons name and hit the pencil icon to edit  - Select the 3 dots in the top right corner and check the box next to all calls to voicemail  That also keeps any texts from that person to being delivered to my inbox. ","Unfortunately, it doesnt stop it on my phone.",False,neutral,[],neutral,no,"['neutral', 'empowering', 'neutral']"
teenagers,man,I have a feeling that they have never taken even a basic class in Economics.,I feel like a lot of political differences would simply dissolve if more people just had a grasp on the fundamentals of Economics.,False,disempowering,[],agree,no,"['disempowering', 'disempowering', 'disempowering']"
relationships,woman,"I have a friend that is/was in the same situation as you two. She and her brother have been married for over 10 years, and have 4 kids. They are still very in love. Congratulations!",Thank you,True,empowering,['emotion'],agree,no,"['empowering', 'empowering', 'empowering']"
teenagers,man,I have a g3 and use it. Its fine for me. Can you recommend a better one?,"Messenger app I was using textra but pictures wouldnt send, thinking about getting the moto x or maybe an iPhone ",True,neutral,[],neutral,no,"['neutral', 'neutral', 'empowering']"
teenagers,woman,I have a great tutor! She helps me with my homework and stuff but I cant do most math on my own,have u tried adderall,True,empowering,[],neutral,no,"['empowering', 'empowering', 'neutral']"
AskReddit,woman,"I have a slap chop, but I got it secondhand.  It actually works as advertised for mincing things pretty well.",youre gonna love my nuts.,False,neutral,[],neutral,no,"['neutral', 'neutral', 'neutral']"
CasualConversation,woman,"I have been to Japan, is one of my favourites countries! People is incredibly nice, and there is so much to do . I have studied abroad in Barcelona, is amazing, so beautiful and you can meet many different people, would definately recomend it","I think the thing that intrigues me about Japan is that, although there are some similarities between American and Japanese culture, theres enough that is very different to make me feel out of my comfort zone, but in a comfortable way, if that makes sense.",True,empowering,[],agree,no,"['empowering', 'empowering', 'empowering']"
teenagers,man,"I have no idea what those are either. Do you mean vanilla like normal, or is it a brand?",vanilla as in plain.,False,neutral,[],neutral,no,"['neutral', 'neutral', 'neutral']"
relationships,woman,"I have not, but we communicated about it and have a plan in place if I feel like I want to - strip club, testing out threesome or soft-swap swinging, etc.  ",How long ago did you come out to your husband?,False,neutral,[],neutral,no,"['neutral', 'neutral', 'neutral']"
Fitness,man,I have video evidence of doing 1 OHP rep at 135 . Six months later I can do about 120.,135 for 120 reps? That is amazing!,False,neutral,['positive'],agree,no,"['neutral', 'neutral', 'empowering']"
teenagers,man,I have ~$500 to spend (no need to put it in the bank or buy anything smart) and Im not sure what to get on Amazon,"Save it?  Maybe build a PC?  I have no clue, I havent had cash in a long while. ",False,neutral,[],neutral,no,"['neutral', 'neutral', 'neutral']"
CasualConversation,woman,I have!  Im listening to a Spotify ad! Woohoo!,Does it make you want to eat Lunchables?  Over The Rhine - Last Night On Earth Again,True,neutral,['emotion'],neutral,no,"['empowering', 'neutral', 'neutral']"
teenagers,woman,I hear traffic is always super bad,Went there for a day and wanted to kill myself because of the traffic,False,neutral,[],agree,no,"['neutral', 'neutral', 'disempowering']"
CasualConversation,man,"I hope he does, good luck. Dont worry about the timescale. What is a long time for you might be a short time for someone else. Ive been with my girlfriend 6 months, I spend every weekend with her and its been touched on repeatedly. ",> I spend every weekend with her and its been touched on repeatedly. (   ),True,empowering,['decision'],agree,no,"['empowering', 'empowering', 'empowering']"
teenagers,man,"I hope mine isnt taking hella dick, and getting a train ran on her by some hood niggas.",She is,False,disempowering,['others'],disagree,no,"['disempowering', 'disempowering', 'disempowering']"
AskReddit,man,"I hope your comment doesnt get buried. This is incredible. Im sure it was extremely bittersweet but imagine how much your dad would have loved that! What a great way to honor your father, best wishes to you and your family.","Before he passed away, we had been planning a trip to New Orleans with the full intention of having a tiny parade. So when he died, we thought it was appropriate to go ahead and have a parade and a band for him. Thanks for the kind words.",True,empowering,[],agree,no,"['empowering', 'empowering', 'empowering', 'neutral']"
AskReddit,man,"I hope youre right Steve, I really do.  My life isnt in pieces, but a couple of important things need working on.  Have a good one :)","Keep on keepin on, man. It will all work out in the end. Or youll die telling one hell of a story haha",False,empowering,[],agree,no,"['empowering', 'empowering', 'neutral']"
Fitness,man,"I imagine the people who were raving about SS/SL/SC have now moved onto a new programme that is for intermediate lifters, so they no longer see SS as a good programme for them. This means they dont recommend it as a result. ",No.  We see it as a poor program as a result of doing one that is not shit,False,neutral,[],No Consensus,no,"['neutral', 'neutral']"
CasualConversation,woman,I just ate watermelon and I dont like taxidermy.,Eating watermelon is nice! You know whats even better? Eating watermelon in New York!,False,neutral,[],neutral,no,"['neutral', 'neutral', 'neutral']"
teenagers,man,I just drove everywhere and its my aunts bday.,hbd,False,neutral,[],neutral,no,"['neutral', 'neutral', 'neutral']"
CasualConversation,woman,"I just finished Hollow City, the 2nd book in the Miss Peregrines Home for Peculiar Children series.  3rd one doesnt come out until September.  Merr.... so I havent decided if Im going to read Revival by Stephen King or just wait for the 3rd peculiar book.  ",Ive read and enjoyed that series! Good mix of history and fantasy.,False,empowering,['alone'],agree,no,"['empowering', 'empowering', 'neutral']"
CasualConversation,woman,"I just googled The Martian and it looks like the kind of book Id love! I like those survival stories, so its definitely up in my list now :)",Yep definitely fits the bill. I really enjoyed it and now cant wait for the movie. Should make for an exciting movie and the cast looks great.,True,empowering,['decision'],agree,no,"['empowering', 'empowering', 'neutral']"
teenagers,man,"I just got back from the middle east (Israel and Jordan).  Heres a picture of me at Petra  And Im going to New York at the end of this month, Ill get back 3 days before school starts.",HEY THAT WAS IN THE TRANSFORMERS MOVIE NO WAY,False,neutral,[],neutral,no,"['neutral', 'neutral', 'neutral']"
AskReddit,woman,"I just hope Im there when my girl (a Beagle) goes. Shes almost 10 now, so shes only got a few years left in her.","I dont know if I could handle being beside them when it happens but then again id hate for them to be alone, you know.",True,neutral,[],neutral,no,"['neutral', 'neutral', 'neutral']"
AskReddit,woman,"I just want to say congratulations. My dad has been in a wheel chair 25 years and has been married to my mother for 16, and he met her after his accident. Just let your true personality shine through and love will find its way. Best of luck!",Thank you so much!!!!!! :D,True,empowering,"['emotion', 'positive', 'true']",agree,No Consensus,"['empowering', 'empowering', 'empowering', 'neutral']"
teenagers,woman,I just wanted to say that this mud mask is amazing and it made me feel so refreshed and whatever    extra,youre a GRADE A CUTIE!! Look at that smile woah,True,empowering,['emotion'],agree,no,"['empowering', 'empowering', 'neutral']"
CasualConversation,man,"I just wanted to wish you luck. My girlfriends youngest sibling has just started the transition into a female and Ive never seen her happier.  Again, best of luck to you!",Thank you so much! I hope everything goes well with your girlfriends sister,True,empowering,"['alone', 'grow', 'emotion']",agree,no,"['empowering', 'empowering', 'empowering']"
relationships,man,"I know OP, it sucks, but sometimes you just have to swallow your pride, and diffuse the situation.  It doesnt matter now. Focus on talking with your bf about the whole ordeal. I really hope that everything turns out okay.",Thank you,True,empowering,['emotion'],agree,no,"['empowering', 'empowering', 'empowering']"
teenagers,man,I know a few girls who accomplished both.  And all of them have long term boyfriends or are bi/mostly lesbian. ;-;,"Yeah, seriously. Why is that? At least *some* of them have to be single.",False,neutral,[],No Consensus,no,"['empowering', 'neutral', 'neutral']"
CasualConversation,woman,I know enough to take it to the gas station once a week and the dealership once every 6 months.   Thats it.,why do you take it to the dealership so often?,False,neutral,[],neutral,no,"['neutral', 'neutral', 'neutral']"
AskReddit,woman,I know it will change as they get older and turn into teenagers so I am making the most of it while I can.,Dad stop it youre embarrassing me!,True,neutral,[],neutral,no,"['neutral', 'neutral', 'neutral']"
