subreddit,poster,post,response,model_generated,empower,reasons,stance,ambiguity,empower_all
teenagers,man,"Just one, but I was with my family/am 17 so didnt have anything to drink. It was an interesting place to see though! Did you do a sightseeing cruise? We did the night one and the city looks so cool lit up",They are amazing! We mainly saw the city on foot bar the metro to and from station,True,empowering,['emotion'],agree,no,"['empowering', 'empowering', 'neutral']"
Fitness,man,Just read the wiki and track your calories every day. Make sure you get and use a food scale. You can achieve the weight loss you want through diet alone but exercise will help speed it up and improve your stamina/strength as well.,Thanks! Ive never used a food scale before.,True,empowering,['grow'],agree,no,"['empowering', 'neutral', 'empowering']"
relationships,woman,"Just remember that being brave isnt a lack of fear, worry or doubt - its the ability to keep going *despite* feeling those things.  Stay strong, OP.  Youve got this.",Thanks so much.,True,empowering,['positive'],agree,no,"['empowering', 'empowering', 'empowering']"
Fitness,man,"Just remember, easy does it. The easiest way to hurt yourself exercising is pushing yourself too hard. Its good to make progress but if you injure yourself you wont make any progress.","Okay, Ill do my best! Ill just have to ask mom and dad not to help me out with the execising, because they tend to force me to push myself very much. ",False,empowering,[],agree,no,"['empowering', 'neutral', 'empowering']"
relationships,woman,"Just simmer down your enthusiasm and contact, while still maintaining the same feel when you interact with her. Basically, Id try to get her to know that: youre interested in her, are not resentful of her choices, but also that you are ok with not moving too fast. Basically just slow down in terms of pushing for things to happen / dates, but be cool and just as much fun / affectionate.  Give her space, but be there for her in the same attractive manner as before. ",Thanks for the response; Im attempting this today.,True,empowering,['emotion'],agree,no,"['empowering', 'empowering', 'neutral']"
teenagers,man,"Just sitting around, a little hungry. Howre you?","Im great! En route to a rodeo that my buddys riding in today. He makes it eight seconds, and well be walking away $10,000 richer. Howre you (besides a little hungry)?",False,neutral,[],neutral,no,"['neutral', 'neutral', 'neutral']"
relationships,woman,"Just take care of yourself. If you want your marriage to work and for you two to be happy, you need to be happy :)",I feel like Ive been trying but that I need my husband to work with me. We live together and I think it would be unproductive/unhealthy to just avoid each other. I feel like he owes me to help me get through the resentment but makes promises he cant keep. I feel stuck.,True,empowering,[],agree,no,"['empowering', 'empowering', 'empowering']"
CasualConversation,woman,"Just try and remember that for them, it really isnt a waste of time! Its helping them process everything thats happened, its relieving stress, and its making them feel better. And youre spending your time proving that youll be there for them, so youre strengthening your relationship with them. Not a total waste :)","Oh yeah, its not like Ive told my SO Please stop talking unless you want to fix this, Im not a heartless bastard! Im sure I do the same with other topics to them :)",True,empowering,"['changes', 'emotion', 'grow']",agree,no,"['empowering', 'empowering', 'empowering']"
Fitness,man,Just using the notches in the smith machine to hold the bar and load it up. Id then pull the barbell out and do squats as normal. I was just wondering if it was important to have the safety bars going across I people have in squat racks.,"Ive never seen this done. Cant imagine how itd work on the smith machine at my gym, so for that reason I wouldnt recommend it. Definitely speak to the staff at the gym.",False,neutral,[],disagree,no,"['neutral', 'neutral', 'neutral']"
teenagers,man,Just wait til you get to college or join the workforce.,why?,True,neutral,[],neutral,no,"['neutral', 'neutral', 'disempowering']"
relationships,woman,Just want to say congrats on making your own choices in life and not having your parents control you.,"Thanks. Im not always immune to their manipulation, but one part of my life where I will always tell them to butt out of is my love life.",True,empowering,[],agree,no,"['empowering', 'empowering', 'empowering']"
AskReddit,woman,"Just wanted to add my own message of support and congratulations. One of my best friends has been clean for over 25 years now, but he says he still thinks about it every day. Just so you know, its possible to get clean and stay clean. For what its worth, this internet stranger is incredibly proud of you!",Thank you so much. hopefully I can speak of my own 25 year sobriety one day. That sounds tough but incredible.,True,neutral,[],neutral,no,"['neutral', 'neutral', 'empowering']"
relationships,woman,"Just wanted to point out that a small amount of dip can be fine and may actually encourage people to eat more veggies, since many people think it improves the taste. A tablespoon of ranch dressing or a Laughing Cow cheese wedge come to mind; both are around 30 calories and should stretch far.","My new favorite thing is fat free plain greek yogurt and mixing in those dip packs (french onion dip is my weakness). Tastes exactly the same, and you can have almost as much as youd like (great protein boost after the gym, actually!)",True,empowering,[],agree,yes,"['empowering', 'empowering']"
AskReddit,woman,"Just wanted to say I read your previous comments out of curiosity since you mentioned it, and you sound like an amazing cousin! Im sure they love having you in their life. I hope they get well soon and you can eventually take them to London.",Thank you for that it really means a lot to me !,True,empowering,['positive'],agree,no,"['empowering', 'empowering', 'empowering']"
relationships,woman,"Just wanted to say, you are an amazing friend! This girl is so lucky to have you in her life!",Im even luckier to have her :) Shed do the same for me.,True,empowering,['positive'],agree,no,"['empowering', 'empowering', 'empowering']"
AskReddit,woman,Keep in mind it just helps with security/customs - not anything to do with your flight.   <link>,"If it makes things go more smoothly, all the better!",False,neutral,[],neutral,no,"['neutral', 'neutral', 'neutral']"
AskReddit,man,Keep practicing! Have you tried to slalom while skiing backwards? This way you can get comfortable skiing backwards and someday youll be able to do a full 360!,No I havent. Ill have to try that next time I go.,True,empowering,[],agree,no,"['empowering', 'neutral', 'empowering']"
Fitness,man,"Keep reading this board, there are few things you want to look into:  * GOMAD if youre skinny/hard gainer  * the ever popular bulk/cut thread  * also LeanGains which advocates *not* to do the bulk/cut but add muscle without adding fat.  I just finished reading *Bigger Leaner Stronger: The Simple Science of Building the Ultimate Male Body* by Michael Matthews and he advocates something similar for nutrition.  At the end of the day, keep on trying and tracking, and see what works for you.","Thanks, Ill give that a try. Since Im still kinda new, Ill probably do normal stuff until the newb gains die off, then readjust accordingly.",True,empowering,"['alone', 'grow']",agree,no,"['empowering', 'empowering', 'empowering']"
relationships,woman,"Keep strong, you can do it. Make plans for each day (loose ones though) so its easier to mark off time. Time in chunks is always more comfortable than just a day stretching out in front of you. This too will pass x",Thank you. I just spent an hour running around catching pokemon and that actually helped.,True,empowering,"['grow', 'changes']",agree,no,"['empowering', 'empowering', 'empowering']"
AskReddit,woman,Keep up trying new things. Its amazing what you will learn about yourself along the way. Plus once you learn to love who you are and all the amazing things you can do love comes much easier when it happens :),"Thank you I most definitely will :) ! The younger to realize that, the better",True,empowering,"['changes', 'skill', 'grow']",agree,no,"['empowering', 'empowering', 'empowering']"
relationships,woman,Kids are a 24/7 job.   There will never be a time when you come home from work and do nothing on a regular basis.,I only need that 10-15 minutes when I get home. She gets their whole nap 1-3 hours depending on the day to relax if she wants to which is why when she dumps things on me the minute I walk in the door is ridiculous,False,No Consensus,['others'],neutral,no,"['empowering', 'disempowering', 'neutral']"
CasualConversation,man,Kings of Leon-Comeback Story  >Im bent on believing everything is alright I break with the day and I bend with the night Its a comeback story of a lifetime A comeback story of a lifetime  Its a hopeful song about being down but not out. I feel down a lot but I know Im not out and not done yet and have time and am making efforts to right this ship.,I remember listening to Kings of Leon on the radio when they were pretty new in the early 2000s. Great song,False,No Consensus,[],neutral,No Consensus,"['empowering', 'neutral']"
AskReddit,man,Knowing that you can trust each other to deal with adversity is a good foundation for a relationship. Good luck!,"thanks for the support, yall are awesome!",True,empowering,['alone'],agree,no,"['empowering', 'empowering', 'empowering']"
relationships,woman,"Kudos to you for trying, dude. Dont go shopping somewhere else if thats the place that you need to get your stuff. Just act normal, do your business like you would anywhere else.","I think Ill try to not visit the shop for some time, and then maybe somewhere in the near future when I have grown a fullbeard and outgrown hair Ill might consider revisiting.",True,No Consensus,[],No Consensus,No Consensus,"['empowering', 'neutral']"
AskReddit,woman,Kudos to you! I always felt it was important to take challenging classes outside of my field. Learning is invaluable.,"Most of my electives were film classes. I took Italian and European cinema, Film Classics, and Film Noir. ",True,empowering,['skill'],neutral,no,"['empowering', 'empowering', 'empowering']"
Fitness,man,Learn how to work harder. You can get a solid workout in in 45 minutes if you know how to really push yourself.,My lifts are 545/395/685.  I know how to work.  You think I can warm up and pull enough sets for my 7 plate deadlift plus accessory work in 45 min?  Give your head a shake.,True,empowering,"['grow', 'skill', 'changes']",disagree,yes,"['disempowering', 'empowering', 'empowering']"
AskReddit,man,Let me fix that for you: I turned 31 last month and Im marrying the most beautiful woman I ever met later this year. We have plans to start a family and I could just about vomit rainbows because Im so overjoyed over how awesome my life is at the moment. :),Awwwe! Congratulations! Im happy for you!,True,empowering,['positive'],agree,no,"['empowering', 'empowering', 'empowering']"
relationships,man,"Let me guess: if she ever took you back, then all would be right in your universe, huh?",Thats how I see it,False,No Consensus,[],agree,No Consensus,"['disempowering', 'neutral']"
Fitness,man,"Lift heavy weight and be at at a caloric deficit.  The more muscle you have on your body, the more energy your body uses to maintain the muscle.  This is turn can cause your body to burn more fat.  Eat high protein meals, but remember to remain below deficit.",This hardly makes a difference. Its actually one of the myths of fitness. Keeping muscle alive does NOT use that many more calories.,False,empowering,[],No Consensus,No Consensus,"['empowering', 'empowering']"
teenagers,man,Like are we talking nothing at all or boxers included?,"Boxers included, haha",False,neutral,[],neutral,no,"['neutral', 'neutral', 'neutral']"
CasualConversation,woman,"Like, iRobot the company? My sister worked there, Ive been trying for an internship for a while. Or the movie with Will Smith?","There is a company? Thats cool, so your sister is interested in the same kind of stuff as you? And yeah I meant the movie lol",False,neutral,[],neutral,no,"['neutral', 'neutral']"
AskReddit,man,Lisa! You are TEARING ME APART!!,"I did not hit her! I did not! Oh hi, Mark!",True,neutral,[],disagree,no,"['neutral', 'disempowering', 'neutral']"
teenagers,man,"Listen. I passed up an opportunity on a girl last summer, and now Im absolutely kicking myself in the ass for it. TAKE THIS OPPERTUNITY. I would do anything to get my chance back, dont let this pass you up or else you might really regret it later like I do","I dont regret resisting the advances of certain guys whose affection I dont reciprocate. I feel kinda bad, but Id regret it more if I led them on.",True,empowering,[],neutral,no,"['disempowering', 'empowering', 'empowering']"
AskReddit,man,LoL whats it mean to Jack Sparrow off a ship?,to JACK off and shoot your SPunk off the ship like an ARROW.,False,neutral,[],neutral,no,"['neutral', 'neutral', 'neutral']"
AskReddit,man,"Look, admitting to your girlfriend that you dont find her sexually attractive because of her weight is difficult, and its good to be honest, thats true.  The douchebag thing is when he then said, If you dont lose this weight, Im breaking it off. The nice thing to do would be to support her through this and help her as best you can. He may not find her as attractive sexually, but theyve been together for five years so one would assume there was more to the relationship than sexual attraction.",I dunno but you sound like you hit your head hard when you were a kid... No fucking way on earth Id be/stay in a relationship with someone Im not sexually attracted to.  ESPECIALLY if it could be avoided.,True,No Consensus,['emotion'],disagree,no,"['empowering', 'neutral', 'disempowering']"
Fitness,man,Looking good bud. Its obviously very possible for you to lose another 10 lbs of fat if you kept up with it and get even leaner. You could try seeing how lean you can go for another month or so and then start bulking.Totally up to you. Either way you look a lot better now than when you started so good job.,"Ya I started at 212 and I currently way 197.20, So I think what I will do is just keep cutting for another month or so, and if I look the way I want I will than start massing and gaining even more muscle mass, however I could look how I want to look and than just stay at the current level I am at but most likely I will just want to get more muscle haha. But deff happy with the progress I have made. So happy I took the before picture. but I could deff lose some more fat so I think that will be the plan. ",True,empowering,"['grow', 'changes', 'positive']",agree,no,"['empowering', 'empowering', 'empowering']"
Fitness,man,Looking great overall Id say. Its mostly posing and learning to flare your lats!,Thank you! Ill definitely have to look into that!,True,empowering,"['grow', 'skill']",agree,no,"['empowering', 'empowering', 'empowering']"
CasualConversation,man,"Looks promising, congrats OP, now what about those dogs?",One is a mutt and the other is a wheaten terrier,True,neutral,[],neutral,no,"['empowering', 'neutral', 'neutral']"
Fitness,man,Looks solid. All good.   Pulling back as well as up is a good cue for helping stop hips from coming up but thats only happening a tiny amount for you.   Keep pulling like that and youll be sorted!,"awesome,  thanks!",True,empowering,"['grow', 'skill']",agree,no,"['empowering', 'empowering', 'empowering']"
relationships,woman,"Lord, next hell be uncomfortable with you wearing underwear because the textile is too close to your genitals, and whats that cotton-spandex blend got thats so special that he lacks?  Thank him for being honest with you and let him know that youll be patient while he works on getting a grip and recognizing that many people are close with their siblings and that that is both normal and awesome. Then continue appreciating your closeness with your brother and being thankful you have someone who will always have your back!",Exactly. I know people who absolutely wish they had a sibling or two theyre as close with as I am with my brother. Of course my boyfriend has a couple younger brothers and 1 elder sister and they arent really close so I dunno what if thats got a bit to do with it,True,empowering,"['emotion', 'true']",agree,no,"['neutral', 'empowering', 'empowering']"
CasualConversation,man,"Love the Boston accent, I think I played a few games where characters have Boston accents and it sounds really distinct and cool, though even the non-distinct American accents sound cute/cool to me.","I love Boston, its such a deep, vibrant, enriching city. And I guarantee you would think my voice is boring. Its the tap water of voices! Haha.",True,empowering,[],neutral,yes,"['neutral', 'empowering', 'empowering']"
teenagers,man,"Love the hair, looking great as always! And I dont think Ive taken any new selfies since early June lmao",Aw thanks,True,empowering,"['emotion', 'others', 'positive']",agree,no,"['empowering', 'empowering', 'empowering']"
teenagers,man,Luckily I still have a month. But I cant say its been very good so far. Ive been thinking about those questions as well... Try to enjoy your last day!,"Thank you, I hope you enjoy your month you lucky duck.",True,empowering,['emotion'],agree,no,"['empowering', 'empowering', 'neutral']"
Fitness,man,"MTS machine whey. Its got more fat and carbohydrates per serving, but it tastes really good.   It is kind of pricey though. ",love mts key lime pie and pb fluff,False,neutral,[],neutral,no,"['neutral', 'neutral', 'empowering']"
AskReddit,woman,MY DADS NOT A PHONE  DUH,"WHAT DO YOU WANT ME TO DO WITH THIS, EAT IT?",False,neutral,[],neutral,no,"['neutral', 'disempowering', 'neutral']"
AskReddit,woman,Maine is also an amazingly beautiful place with some of the nicest people ever. It can be hard to keep kids away from scary shit but good influences count for a lot. I believe in you :),I appreciate the sentiment. I guess well see when these little bastards grow up!,False,empowering,[],agree,no,"['empowering', 'empowering', 'empowering']"
relationships,woman,"Make it a priority. It may seem impossible, but thats in your head! Good luck, hun. :)",Youre right. I need to stop imagining doing it and just do it. Thanks again for your advice.,True,empowering,[],agree,yes,"['empowering', 'empowering', 'empowering']"
AskReddit,woman,Make plenty of *scheduled* stops. Even if youre just stretching your legs this will keep the mood light and will give you a chance to eat/drink unrestricted.,Good idea!,True,empowering,"['options', 'skill']",agree,no,"['empowering', 'empowering', 'empowering']"
AskReddit,man,"Man Id love to give you some advice, but the only advice I can give is negative. So Im going to keep my mouth shut. I hope the best for you though! Maybe someone can have a happy ending.","Nah man, lay it to me straight. ",True,neutral,[],disagree,no,"['neutral', 'empowering', 'neutral']"
AskReddit,man,"Man, seriously thank you for this! I started biking again recently, and while its awesome, I know I need to do something in addition to it. This gives me the outline and motivation to do so. Thanks!","Epic! Are you doing trails, downhill or road riding?",True,empowering,[],agree,no,"['empowering', 'neutral', 'empowering']"
CasualConversation,woman,"Man, that sucks. For what its worth, I just got an IUD put in on Monday and woke up this morning with horrible pain because I forgot to take ibuprofen or anything last night. But hey, no babies for three years.",Yayy for being safe! And dont forget to take that ibuprofen! Helps with inflammation and pain,False,neutral,[],No Consensus,no,"['neutral', 'neutral']"
teenagers,woman,Managed to get the diploma! Did not expect it bc of the way HLs worked out but did surprisingly well :),Nice!,True,empowering,"['grow', 'skill', 'emotion']",agree,no,"['empowering', 'empowering', 'empowering']"
relationships,woman,Many people complete their education while working full-time. Is there any way you can do both? Take one course a semester while continuing to work full time.,"I believe my best shot to be successful would be to focus in school. I am also only eligible for GPA forgiveness if I am a full time student.   I could probably finish some degree part time or online, but in my local market I would be stuck in lower paying staff accounting jobs (entry level around $30k with a pretty low ceiling). I would still be haunted by my awful transcripts and low GPA from my first college attempt.",True,empowering,[],agree,yes,"['empowering', 'empowering', 'empowering']"
AskReddit,woman,May I humbly suggest you also use some of it for therapy. There is no shame in that and talking it out will help you get closure without sharing your secret with your family.,Ask reddit throw always are free though,True,empowering,['changes'],neutral,no,"['empowering', 'empowering', 'empowering']"
AskReddit,woman,"Maybe call a relative or friend who has a car? Youll figure it out. I wish you luck, kid. ","Thanks. I dont have any friends who can drive, but Im sure I can figure something out.",True,empowering,"['decision', 'critically']",agree,yes,"['empowering', 'empowering', 'empowering']"
relationships,woman,Maybe his feelings have changed for you :) Just talk to him so that both of you guys are on the same page and know exactly what he means!,Maybe or maybe not...I guessing my best bet would just be to ask him. Thank you for your comment.,True,empowering,['emotion'],neutral,no,"['empowering', 'empowering', 'empowering']"
AskReddit,woman,"Maybe talk therapy, either one on one with a doctor or in a group setting, might be beneficial to you. It can be cathartic to have someone to vent your feelings to who isnt going to judge you or dismiss you and who understands.",Yeah :),True,empowering,['emotion'],agree,no,"['empowering', 'empowering', 'empowering']"
CasualConversation,woman,Maybe you and your friend can go splitsies on a rental car and leave mum behind for a day. Im sure your friend would get on board.,"Weve spoken about this but it couldnt happen, there is nothing local for us to get and shes concerned about upsetting her mum.",False,neutral,[],No Consensus,no,"['neutral', 'neutral']"
relationships,man,Maybe you should wait to try and date until you are in a little bit more of a stable mindset. Stick with the therapy and dont pursue someone until you are managing you anxiety in a healthy way.,"Thanks for your answer.   Things are under control anxiety-wise overall. Its more about not fucking-up by giving too much information at the worse possible timing and understanding when its okay.  Im not really afraid of being judged by peers anymore, still I cant deny it might frightnen people...",False,empowering,"['changes', 'decision', 'emotion', 'grow']",agree,no,"['empowering', 'empowering', 'empowering']"
Fitness,woman,"Me neither. Not only is it an overpriced fashion shoe (over here they retail around 70 euros, indistinguishable replicas retail around 10 euros), but the flat sole makes them unsuitable for weight lifting, weightlifting (squatting) shoes should have a raised heel, at least if you want to squat deep with a full range of motion.",70 Euros is definitely too much. I get them for $20-30 here. Their cheapness is part of why theyre awesome.,False,neutral,[],neutral,no,"['neutral', 'neutral', 'neutral']"
AskReddit,woman,Me too! Feels great right?,Best feeling in the world,True,empowering,[],agree,no,"['empowering', 'empowering', 'empowering']"
CasualConversation,woman,"Megathread for context  Victoria didnt just help people figure out how to use the site, she made sure that we got the actual celebrity and not their PR or manager. She did her best to keep things like the whole Rampart thing from happening.  This isnt specifically about her firing, that was just the straw that broke the camels back after literal years of miscommunication and dickery from the admins towards the mods.",I dont focus to much on this stuff but wasnt she also answering the questions on behalf of the people too?,False,neutral,[],neutral,no,"['neutral', 'neutral', 'disempowering']"
teenagers,man,Message Steam Support about being banned from the trading market.,"I have, and have yet to get a response on lowering the ban from a permanent one. I have never been banned before so to find it was permanent suprised me.",False,neutral,[],neutral,no,"['neutral', 'neutral', 'neutral']"
teenagers,man,Might need this. Thanks bro.,No problem. Im guessing youre in the UK (or maybe Europe) because you seem to be in the same time zone as me? Not many UK teens on this sub.,False,neutral,[],neutral,no,"['neutral', 'neutral', 'neutral']"
teenagers,man,Mine are Indian. Theyre from a society that expects parents to micromanage their kids lives. It sucks ass.,Indian food though,False,disempowering,['others'],neutral,no,"['empowering', 'disempowering', 'disempowering']"
relationships,woman,Mine is still in the fancy envelope they sent it in.,Ny boyfriend got his framed finally a year free getting his diploma... And only cause his mom bought him the frame,False,neutral,[],agree,no,"['neutral', 'neutral', 'empowering']"
