subreddit,poster,post,response,model_generated,empower,reasons,stance,ambiguity,empower_all
teenagers,man,"(Sorry, went to get lunch) Its redditors debating about which fictional characters could out-compete/kill others.",Ahh very cool I shall check it out!,False,neutral,[],neutral,no,"['neutral', 'neutral', 'empowering']"
teenagers,man,**BIG BROTHER IS WATCHING YOU**,**WAR IS PEACE**,False,No Consensus,[],neutral,no,"['neutral', 'empowering', 'disempowering']"
CasualConversation,man,*Let me love you stranger* >:-),sure :),False,empowering,['emotion'],agree,no,"['empowering', 'empowering', 'neutral']"
AskReddit,woman,"*internet panda hug* I dont like lying, but I honestly believe that if you are honest enough to share this and brave enough to get your heart broken then there is so much hope for you. Be strong ok? I love you",I love you too. Thanks.,True,empowering,['positive'],agree,no,"['empowering', 'empowering', 'empowering']"
relationships,woman,*looks sadly around at the tiny one bedroom she lives in. a steal in San Diego at $1350 a month...*,"Damn, that is a good deal! Im in San Diego, and I pay a reasonable (relatively) $1800 for a 2 bed 2 bath. Most one bedrooms Ive looked at are more like $1600 or so right now.",False,neutral,[],agree,no,"['neutral', 'disempowering', 'neutral']"
Fitness,man,"- Chicken breasts - Broccoli  - Oatmeal - Bananas - Eggs - Rice - Whey protein - Nuts  Im sure you can add a couple more things in there... as well as seasoning and perhaps something to sweeten your oatmeal.  If you havent already, itd be a wise idea to get MyFitnessPal and weigh your food. ","Pretty much the bulk of my foods up there just add in Greek yogurt, bananas, and granola. I put honey in my oatmeal and peanut butter instead of nuts.",False,empowering,[],agree,no,"['empowering', 'neutral', 'empowering']"
AskReddit,woman,...all caps indicate screaming. I was just trying to differentiate my responses to u/ThereisnoTruth with a very limited unerstanding of reddits html.,Youre forgiven. And thanks for your original comment :),False,neutral,[],neutral,no,"['neutral', 'neutral', 'empowering']"
CasualConversation,man,"...are you sure its a cat, and not like... a piranha?",A hair piranha. That swims in air and can climb curtains.,False,neutral,[],agree,no,"['empowering', 'neutral', 'neutral']"
relationships,woman,"/r/longdistance  all i can say is good luck. its okay to be optimistic, but dont be afraid to let go if it doesnt work out. dont let an LDR hold you back, especially at the beginning of college.",Thank you,True,empowering,"['emotion', 'options', 'changes']",agree,no,"['empowering', 'empowering', 'empowering']"
CasualConversation,woman,/r/socialskills  might be of some help to you,I subbed! Thanks,False,No Consensus,['skill'],agree,no,"['disempowering', 'neutral', 'empowering']"
Fitness,woman,"/r/vegan would be furious to hear that. Theyre always going on about vegan body builders, since they seem to exist.",How about I go in there and slap their shit?,False,disempowering,['critically'],neutral,no,"['disempowering', 'disempowering', 'disempowering']"
teenagers,man,"1, im the only atheist in my school and hated quite abit for it. ironically people come to me for wisdom but idk why ",Because youre clearly the wisest one there...,False,No Consensus,[],neutral,no,"['neutral', 'disempowering', 'empowering']"
teenagers,man,"10 point scale? If so, youll be fine. You should really try to do your homework at first though, until you get a feel for what you can get away with not doing while still having a good overall grade.   But my biggest advice is dont stress yourself too much, youre going to do badly in some areas, but if you just believe in yourself youll see the results",Ok thanks man,True,empowering,['skill'],agree,no,"['empowering', 'empowering', 'empowering']"
relationships,man,"13 is the perfect age to start riding a bike, I started when I was 10. All the kids as to do is not be a complete obvious idiot and hell be fine. ",Started at 10 too but 7 is completely normal too . And I know one guy who could ride a 50ccm at the same time he learnt walking,False,empowering,['skill'],agree,no,"['empowering', 'empowering', 'empowering']"
CasualConversation,man,1397-1523 best time of my life!  Why did you choose Sweden?,A couple of reasons.  English competency  Germanic based language  I like winter  Swedish culture is interesting to me  Swedes are ranked as some of the most beautiful people in the world lol.,False,empowering,[],agree,no,"['neutral', 'empowering', 'empowering']"
Fitness,man,"17 looks right to me.  Youve got the arms and the abs, hit that chest!  Nice work.","thanks man! and trust me Im trying to hit that chest hard! going 3x per week atm, suckers just dont seem to grow, but now Im back in a surplus so we will see what happens!",True,empowering,['positive'],agree,no,"['empowering', 'empowering', 'empowering']"
teenagers,man,18 and kiss virgin ontop of virgin.  Unless you count cuddling with my pillow as something.,Kiss virgin as well here,False,No Consensus,[],agree,no,"['empowering', 'disempowering', 'neutral']"
Fitness,woman,"2 things:   Women dont climax as quickly as guys: not true. Has nothing to do with gender. Different people need different times to achieve orgasm.   Which takes to the second thing, Good pounding: not the best way for a woman to reach said climax. ",*whooosh*,False,neutral,[],neutral,no,"['neutral', 'neutral', 'disempowering']"
CasualConversation,man,"4) Hey, thats a really brave thing to do :) I wish you the best. Do you think they will receive it well?  5) I usually go ketchupless. My favourite are the waffle cut kinds","I know they will, I still dont know how to say it though.",True,empowering,[],agree,no,"['neutral', 'empowering', 'empowering']"
CasualConversation,man,4/10  Nice try! Ironically some of the answers you had the least faith in turned out to be correct. :D,"Welp. Like I said, a wrong answer is better than no answer so always put something in.",True,empowering,"['competency', 'critically']",agree,no,"['empowering', 'empowering', 'neutral']"
Fitness,man,"5-8 hours separation is huge, you dont need nearly that long to recover.","True, but I was discussing my personal preference not the science of true things in lifting by Zatsiorsky",False,disempowering,[],No Consensus,no,"['neutral', 'disempowering', 'disempowering']"
Fitness,man,5x5s a bitch. I used to train 6 days a week. Can barely accessorize.,"You could do cardio instead, or some other kind of fitness activity, like martial arts for example. Theres plenty of options :)",False,neutral,[],neutral,no,"['disempowering', 'neutral', 'neutral']"
CasualConversation,man,"9.35 am, at work, browsing the tubes while stuff compiles.",What do you do for work?,False,neutral,[],neutral,no,"['neutral', 'neutral', 'neutral']"
teenagers,man,:( at least its not humid in Arizona.,Oh yeah its a *dry heat* because that makes it just *soooooo* much better.,False,No Consensus,['critically'],agree,no,"['neutral', 'disempowering', 'empowering']"
relationships,woman,<3 Hopefully your school can help you too if you have a hard time. Check if they have disability services because depression is a disability.,"They do have them, I just chose not to use them because Im a lot better now and Id like to work without receiving a lot of the crutches they were offering and many of them were unnecessary to be honest.",True,empowering,[],agree,no,"['empowering', 'empowering', 'empowering']"
Fitness,man,<link>  Can you identify the spot on this picture?  I have a feeling youre talking about the shoulder blades.,I assume hes meaning Rhomboids,False,neutral,[],neutral,no,"['neutral', 'empowering', 'neutral']"
Fitness,man,<link> <link> <link>  It depends a lot on age and genetics. But with the right plan and tons of hard work a lot can be done in a year time.,Im 16 and I think I have good genetics btw.,False,empowering,['changes'],neutral,no,"['empowering', 'empowering', 'empowering']"
Fitness,man,<link> answers all your questions and more in detail. Make sure to read it and good luck on your new healthier life style!,Thanks so much!,True,empowering,['emotion'],agree,no,"['empowering', 'empowering', 'empowering']"
teenagers,woman,<link> gryffindor pride   Dress picccc <link>,You look great,False,neutral,[],neutral,no,"['neutral', 'empowering', 'neutral']"
AskReddit,man,"A Phone yes, a smart phone no. Plus, if youre really desperate, selling an iPhone can probably get you a few meals plus a nice cheap flip phone. Also income is generally necessary to keep the phone operational.","Smart phones can still be operational without minutes if you use them at spots with free wifi, not for calls unless you use like google voice or whatever its called, or skype, which then makes it a lot more able to be afforded because you arent constantly buying minutes (no minutes, no upkeep). There are programs that will take donated phones and offer them to homeless people who are willing to go through rehabilitation programs. Also, your argument of can probably get you a few meals is taken from the stance of someone who apparently hasnt been homeless, and doesnt understand the value of a lifeline like that. Sometimes, phones and other technological devices are the only things tethering these people to loved ones, or potential help.",False,neutral,[],agree,no,"['empowering', 'neutral', 'neutral']"
relationships,woman,"A couple people mentioned environmentally friendly ways to do this. If youre interested, these are some of my favorite things. Theyre so beautiful the way they light up the sky :)",Thank you.  Those look amazing.  I hope I can find a local seller.,True,empowering,[],No Consensus,no,"['empowering', 'empowering']"
Fitness,man,A day wont make a difference.  Do what you wanna do.,"Aight man, hitting the hay is what Im gonna do then. Thanks!",False,empowering,['decision'],agree,no,"['empowering', 'empowering', 'empowering']"
teenagers,man,A fellow high jumper then? Thats my event of choice haha. Definitely pursue it man its great fun and healthy.,"Whenever we do high jump, everyone in my class is out by 1 m 20, and then they just watch me jump up to 1m 40 for the rest of the lesson. Im just short of my own height for jumping height",True,empowering,['positive'],agree,no,"['empowering', 'empowering', 'neutral']"
relationships,man,A little bit of inattention isnt worth breaking up over.,Youre stupid.,False,No Consensus,"['critically', 'emotion']",disagree,yes,"['neutral', 'disempowering', 'empowering']"
AskReddit,woman,"A lot of weather forecasting models etc are written in fortran. So if you checked the forecast today, youve probably used it.   I believe its very fast and efficient so useful for such huge calculations as forecast models. However they were probably all started in the early days when fortran was a standard language, and have continued to be programmed in it, as a complete re-write of a forecast model is a huge undertaking. ","^ yup, my parents are meteorologists and they almost exclusively use Fortran.",False,empowering,['skill'],agree,no,"['empowering', 'neutral', 'empowering']"
Fitness,man,"A proper standing barbell OHP has a bit more nuance to the form. Making sure the line from wrist to elbow is perpendicular to the ground, and getting your elbows under or slightly in front of the bar will go a long way. You should definitely check out some form videos on youtube: this is a good one with some common fixes <link>","great video, thanks!",True,empowering,"['grow', 'positive', 'skill']",agree,no,"['empowering', 'neutral', 'empowering']"
teenagers,woman,AW ur actually so cute (i thought u wouldnt be since u never did pic) (pls)  ALSO i like ur hair!!!,thank u roxy <3,False,empowering,['positive'],agree,no,"['empowering', 'empowering', 'empowering']"
teenagers,woman,"Accept the things you cant change, have courage to change the things you can, and learn to know the difference.",Isnt that a Steve Jobs quote?,True,empowering,"['changes', 'critically', 'grow', 'competency']",neutral,no,"['empowering', 'empowering', 'neutral']"
AskReddit,man,"According to Google and every prison Ive visited , if the prisoner cant pay, the government picks up the tab. ","They pick up the bill yes,  but with repayment.  ",False,neutral,[],agree,no,"['empowering', 'neutral', 'neutral']"
AskReddit,woman,Actually I want it cut shorter! But I had long hair and got it cut mid length cuz I was a puss.,Whats stoppin ya? Chop it off! :D,False,No Consensus,['decision'],agree,no,"['disempowering', 'neutral', 'empowering']"
AskReddit,woman,"Actually, there are. I saw a thing on HBO about it once. Gay for pay - its a thing.",I shouldve assumed. I bet theres a True Life about it as well.,False,neutral,[],neutral,no,"['neutral', 'neutral', 'disempowering']"
Fitness,woman,Add some eggs and bread soaked in milk!,No bread filler needed! Turkey burgers or meatballs can stay together and be nice and moist without it.,False,neutral,[],disagree,no,"['neutral', 'neutral', 'empowering']"
CasualConversation,woman,"Adorable! Is your hair actually that color, or did you jazz it up for the pic?","Thanks! And yeah, I dyed it purple halfway through my sophomore year of college and thought it was pretty rad so I kept it.",False,empowering,['positive'],agree,no,"['empowering', 'empowering', 'empowering']"
relationships,woman,"After reading your edit -- this doesnt sound like youre bad at relationships. You two have communicated your expectations clearly (or at least you listed them clearly in your examples.) The issue is that your expectations are not compatible with one another -- particularly on spending time together. Unless you can reconcile those expectations, and find a middle ground both parties can be satisfied with, then it makes a lot more sense to end the relationship instead of continuing to clash on these same expectations.","Weve tried to find a middle ground but because of how complicated and rooted our problems are, for me, its become almost impossible to compromise with her. I still try to do my best and work things out though..  But almost always, I end up folding and giving into her ways.",True,empowering,"['changes', 'decision']",agree,no,"['empowering', 'empowering', 'empowering']"
teenagers,woman,"Agreeing with Fisher. And you can keep a close relationship by loving her as a friend and not pushing her. Then swoop in when your window opens, OP",Thanks for the advice (:,True,empowering,"['decision', 'emotion']",agree,no,"['empowering', 'empowering', 'empowering']"
Fitness,woman,Ah ok. I am in the US.,"Ireland here. I see some British brands in the lists that we do get but theyre still very, very few.",False,neutral,[],neutral,no,"['neutral', 'neutral']"
CasualConversation,woman,"Ah, got it! I can complain too! Woohoo!  Perhaps I should complain about how I dont have anything to complain about.","My life is too perfect, so I cant complain on Facebook for sympathy likes  Something like that should get you to the top of firstworldproblems!",True,No Consensus,[],agree,no,"['empowering', 'disempowering', 'neutral']"
CasualConversation,man,"Ah, makes more sense!  Yeah, I know a few people who cringe whenever I crack my hands. Its pretty funny imo.",Its kind of a gross sound actually haha. To me at least. But at least you find it amusing :P,False,neutral,[],neutral,no,"['empowering', 'neutral', 'neutral']"
relationships,woman,"Ah, nice. Yeah.... that seems reasonable.  Does your gf have family nearby? Maybe you can encourage her to do like mother daughter dates on these days or something",I get what youre trying to do here. But he should be able to go to a soccer game regardless of what his gf has planned or not.,False,empowering,['changes'],neutral,no,"['disempowering', 'empowering', 'empowering']"
AskReddit,woman,"Ah, that is awesome. I really hope she gets to do that one day, without life getting in the way and forcing her down another path.","Well, Im a social entrepreneur starting a makerspace, and her father is an artist and musician so she has a lot of support from us. She also wants to be the President and librarian though. At the same time.",True,empowering,[],agree,no,"['empowering', 'empowering', 'empowering']"
teenagers,woman,"Ah, thats kind of awesome. Sounds like a good way to go","The documentary is called Terry Pratchett: Choosing to Die.  If you want a really sad doc on a much similar topic, watch How to  Die in Oregon. It is the best documentary Ive ever watched. So touching.",True,empowering,['emotion'],agree,no,"['empowering', 'empowering', 'empowering']"
Fitness,man,"Ah. You can get the bumper plates, kettlebells, and rowing machine at The Training Station in Northern Liberties for $40/month, which is also never crowded, but not the classes, courts, or pool. I wouldnt be using that stuff anyway though.","Im in the heart of center city so I couldnt get to that gym, thanks for the heads up though. I only use the classes for yoga, other than that I just like how I can do my whole routine and not have to wait. ",False,neutral,[],neutral,no,"['neutral', 'neutral']"
Fitness,man,"Aha thanks for that, the way I tune out when I run, I feel that this is very possible","Its old, but one of my favourite TV commercials.",True,empowering,[],neutral,no,"['empowering', 'empowering', 'empowering']"
teenagers,woman,Ahaha nope. 4:30 AM Im out of bed. I suppose if I really wanted to clip my morning routine short I could get up at 5:30 but then Id have to rush myself into clothes and have my parents drive like the wind to get to school on time.,When does your school start? Or do you just live far away?,False,neutral,[],neutral,no,"['neutral', 'neutral', 'neutral']"
AskReddit,woman,"Ahahah that was awesome. I feel bad for the guy, even though its acted.","Yeah, she played him like a fucking flute.",True,neutral,[],agree,no,"['neutral', 'neutral', 'neutral']"
teenagers,woman,"Ahh I see. Well, I guess you could just ask her on a date or take time. Either way would get you somewhere eventually. But seriously, ask her out if she likes you!","Ive decided the next step is to definitely let her know that I like her and take things from there.  If the feeling isnt mutual, I can just drop it and move on; If it is, I can go from there. Its mostly just the uncertainty that is killing me to be honest.",True,empowering,"['assertive', 'emotion', 'true']",agree,no,"['empowering', 'empowering', 'empowering']"
CasualConversation,woman,"Ahh, good ol Shrek. Universally known all over YouTube.","Shrek is love, shrek is life ;)",False,neutral,[],agree,no,"['neutral', 'empowering', 'neutral']"
teenagers,man,Ahhh thats awesome! Im a huge Michael Cera fan :),O m g saaame! I am so obsessed w/ him :),True,empowering,['emotion'],agree,no,"['empowering', 'empowering', 'empowering']"
CasualConversation,man,Air Force One  Training Day  End of Watch  Disturbia   Jaws  Super 8,"Emphasis on Super 8, OP",False,neutral,[],neutral,no,"['neutral', 'neutral', 'neutral']"
AskReddit,woman,Air bomb:  Suddenly blow a bunch of air into the other persons mouth while youre kissing.,My brothers ex used to do that to him,False,neutral,[],neutral,no,"['neutral', 'neutral', 'neutral']"
AskReddit,man,Alcohol because it drowns my sorrows.,"To alcohol, the cause of and solution to all of lifes problems!",False,neutral,[],agree,no,"['disempowering', 'neutral', 'neutral']"
CasualConversation,man,"All 3 of them so far..... I wish I could watch them all in one go like I did with the first series, but I have to wait for the new stuff :(",Thats pretty much why I dont watch regular tv anymore. I hate waiting.,False,empowering,"['alone', 'emotion', 'true']",agree,no,"['empowering', 'empowering', 'empowering']"
relationships,man,All you can do is give her space. Dont pester her.  she is just over welmed with everything thats happening and just needs to absorb it and then decide what she wants.  Give her a couple days then reach out to her and ask her how shes doing.,"Thank you... I really like this girl and hope she likes me back so I think giving her some space would be best, I just hate constantly looking at my phone hoping to see I received a text message from her and there be nothing",True,empowering,"['competency', 'critically']",agree,no,"['empowering', 'empowering', 'empowering']"
CasualConversation,man,"All you need is to work out more, and you will succeed one day :)",Either that or turn super saiyan!,True,empowering,"['positive', 'changes']",agree,no,"['empowering', 'empowering', 'empowering']"
Fitness,man,"Almost 3 excuses in one post, against deadlifts...  At a complete guess, you probably dont have the best traps/lats/glutes/hams/quads/core compared to someone who does seriously deadlift...","I deadlift or a variation of it 2 times a week, Im just saying that you dont have to do them if you dont want to. Everybody here acts like deadlifts have to be done and theyre the answer to every problem.  Those arent excuses, theyre reasons people dont do them. Theyre much more taxing than most other exercises when you lift heavy relative to you and they should absolutely be avoided if you have lower back problems unless you consult a physician.",False,disempowering,['critically'],disagree,no,"['disempowering', 'disempowering', 'disempowering']"
AskReddit,woman,"Almost every Spice Girls song. I was singing those lyrics at 12 years old, and I totally didnt get it until later.",Really really really wanna zig a zig ahhhh....,False,neutral,[],neutral,no,"['neutral', 'neutral', 'neutral']"
teenagers,man,"Along with posting it to /r/Sacramento, I would also post it to /r/California. Get it out through Twitter and Facebook of course. And since she is officially a missing person, try contacting your local newspapers and news stations, see if they can run the story.  Good luck, sorry youre in this situation.","Yeah I actually found the picture linked floating sound on instagram, my school has nailed getting the word out. I just figured Id hit up reddit. Thanks for the advice.",True,empowering,"['alone', 'assertive', 'difference', 'emotion']",agree,no,"['empowering', 'empowering', 'empowering']"
AskReddit,man,"Alright, hun, can you put back this bottle of ketchup?",Oh my god. How did i not see this?,False,neutral,[],neutral,no,"['neutral', 'disempowering', 'neutral']"
relationships,woman,"Alright, youve done what you can! Best thing to do now is to put this in the past and move on. Use it as a lesson and try to drink less in the future. ","The problem is though, we share mutual friends so the possibility of meeting each other is extremely high.",True,empowering,[],neutral,no,"['empowering', 'empowering', 'empowering']"
Fitness,woman,"Also as no-ones mentioned it yet, youll be better off not using the pad. Its easier to get the bar in a consistent position and hold it steady without a compressible pad in the way.","It seems like this is a result of fucking up my form somehow, but all of my friends who go to the gym say different. What does it mean when the bar causes a sharp pain at the top of the spine whenever youre doing squats or lunges?",False,empowering,[],neutral,no,"['neutral', 'empowering', 'empowering']"
teenagers,man,"Also dont use a locker. Just keep everything in your bookbag, its easier","100% agree, the only thing i kept in my locker were some papers from the first week and my gym strip",True,neutral,[],agree,no,"['neutral', 'empowering', 'neutral']"
Fitness,man,"Amazing man, guys like you are what motivate me to reach down to 220-215 lbs. I still never lost that eating mentality of being a lineman. How much do you incorporate cardio into your routine?   Oh and monster quads man!","When I was in my major cutting phase I was doing two 20-25 minute sessions a day, one before and one after my lift.   Now I do 20 min on work days and 20-25 minutes of a HIIT routine on off days or play basketball. ",False,empowering,[],agree,no,"['empowering', 'empowering']"
Fitness,man,"An excuse for an excuse of an excuse...  You shouldnt try to convince people that deadlifts are bad, when they are essentially one of the best movements humans can do in the modern age (i.e. modern lifestyles).","Which part of anything I said implies deadlifts are bad? Since Im not saying theyre 100% completely important like everybody here makes them out to be it means it doesnt mean Im saying theyre bad.  If you dont like/enjoy them, if they cause pain or discomfort or your just dont want to do them you DONT have to.",False,disempowering,[],disagree,No Consensus,"['disempowering', 'disempowering']"
teenagers,man,"And I got fucked over by being born here with my condition, 1 mil+ in medical bills so far. yay...",Damn. Whats your condition?,False,neutral,[],neutral,no,"['neutral', 'neutral', 'empowering']"
relationships,woman,And know that its ok to be sad. Its ok to mourn the loss of someone you love - whether they were great or they were awful. Its normal and you shouldnt feel weird or bad because of it.  Good luck :),Thanks much.  I will keep on keeping on.,True,empowering,['emotion'],agree,no,"['empowering', 'empowering', 'empowering']"
AskReddit,woman,And still no shits are given.,It is so sad how you dont give a shit about your exs private shit.,False,neutral,[],neutral,no,"['neutral', 'neutral', 'disempowering']"
relationships,man,And that he called her dumb.  Remember that.  He deliberately called her dumb.  Smart guy.,"Oh I agree about that. Im just pointing out that his issue doesnt seem to be with her playing kids games, but rather a general lack of motivation in life. While your comment made it sound like what a dick, stop judging what games she plays, I play those and Im succesful.",False,neutral,[],agree,no,"['neutral', 'disempowering', 'neutral']"
