subreddit,poster,post,response,model_generated,empower,reasons,stance,ambiguity,empower_all
AskReddit,man,"The problem is that often, people who say limited government mean no oversight and fiscal responsibility mean starve the poor.   When I hear that doublespeak day in and day out, my kneejerk reaction tends to be to discount anything coming from the small government crowd.","Yeah, Limited government always seems to be code for a powerful military-industrial complex and an intrusive police state targeting immigrants, minorities and gays. ",False,empowering,['critically'],agree,no,"['neutral', 'empowering', 'empowering']"
relationships,woman,The relationship is over. Let it be over. Pushing her over and over again to take you back is just gonna result in a cycle of being together for 3 days then her breaking it off again,The thing is: I havent pushed her in any way. She made the decision to try again.,False,No Consensus,['critically'],No Consensus,yes,"['empowering', 'disempowering']"
teenagers,man,The sound of OPs retarded and unwarranted butthurt can be heard for miles.,Youre the reason america is full of fat ass retarded ass teens.,False,disempowering,['emotion'],disagree,no,"['disempowering', 'disempowering', 'disempowering']"
Fitness,man,The username is something that I keep telling myself Ill grow into. And godammit I will!,DO IT! OR I WILL COME FIND YOU AND KICK YOUR ASS!...or Ill try to...actually my only combat skill is running away.,True,neutral,[],neutral,no,"['neutral', 'neutral', 'neutral']"
AskReddit,man,The very thought of killing this person is just too awful for words.,"Despite the childish snark and defensiveness, it is a person, nonetheless.    You - all of you, everything you are and all that you will ever be or do - was once a group of cells just like that.  ",False,neutral,[],neutral,yes,"['neutral', 'disempowering', 'neutral']"
teenagers,man,The way I look at clothes; Anyone can wear anything they want as long as they have the confidence to pull it off. So go for it!,You convinced me!,True,empowering,['positive'],agree,yes,"['neutral', 'empowering', 'empowering']"
CasualConversation,woman,"The west coast is amazing! I think it would definitely be hard to live in San Francisco, but its still really neat to visit!",Can you imagine having to navigate around that place? No thanks. Do you live on the west coast?,True,empowering,['others'],neutral,no,"['empowering', 'empowering', 'empowering']"
teenagers,man,"The whole Syria situation is too confusing at this point, I think. If you support the FSA, youre supporting the Jihadists (to a degree). But if you support Assad, youre supporting a terrible regime.",Either way both sides are killing innocent lives.  And it has been proven that both sides have used chemical weapons.,False,neutral,[],agree,no,"['neutral', 'neutral', 'disempowering']"
CasualConversation,man,The whole other 2 parties right? American politics...Ive no idea!,"Well, Independent parties could have a chance, but Independents have a better chance running as either a Democrat or a Republican since those are the two main parties. So who knows? :D",False,neutral,[],neutral,no,"['neutral', 'empowering', 'neutral']"
relationships,woman,Then he needs to get himself into therapy. This isnt a healthy relationship for you and his life isnt healthy for him. DO NOt have a baby with this guy.,We have two separate sessions of therapy and a couples therapy session next week.,False,empowering,['decision'],neutral,no,"['empowering', 'empowering', 'empowering']"
teenagers,man,"Then in that case, I guess youre stuck with getting an iPod. But yeah, I just discovered you could do that with Google, and having everything synced across your phone and desktop is awesome. I can leave the house, turn on my phone, and all my Chrome tabs are there, the song that I had last played is loaded, and I can continue my conversations. I highly recommend it. ","nice. i seriously considered getting a nexus 4 or 7, but having iCal integration just happen, and be able to trust that itll just happen, is too good",True,neutral,[],neutral,no,"['empowering', 'neutral', 'neutral']"
relationships,man,Then it makes sense that the feelings are still raw.  Give it some time and youll recover.  Just make sure that your interactions with your ex are strictly kid-related.,"Im trying to do that as hard as I can, but we end up in the same car picking her up twice or 3 times a week and its hard for me to even look at her.",True,empowering,['grow'],agree,no,"['empowering', 'empowering', 'empowering']"
Fitness,man,"Then its all yours! My gym only has one squat rack and one power rack and a lot of people who never learned about sharing and taking turns. Theres a group of us who work in together and I actually prefer it. Seems to make time pass faster, which on ice cream fitness is definitely a plus!","Okay. We have 4 racks total, which apparently is better than a lot of peoples. The problem is that people often seem reluctant to ask to work in.",True,neutral,[],neutral,no,"['empowering', 'neutral', 'neutral']"
relationships,woman,"There are 7 billion people on earth, be realistic here",And how many of them are you going to meet in your lifetime? How many of them do you have a realistic chance to be in a relationship with? 7 billion is totally irrelevant.,False,No Consensus,['critically'],disagree,no,"['empowering', 'neutral', 'disempowering']"
relationships,woman,"There are auto masturbators, for lack of a better term, out there for dudes. Some of them just vibrate, but there are ones that (from what it seems to me, considering I cant use them) you pretty much just stick on your dick and it strokes and vibrates and all that other fancy stuff by itself.",They are no different to a rampant rabbit....girls get a dick shaped toy...we get a vaginal shaped one.,False,neutral,[],neutral,no,"['neutral', 'neutral', 'neutral']"
Fitness,man,"There is lots of discussion both ways, however it seems generally accepted that every day is overkill they still need recovery time. Personally I treat them like any other muscle and do weighted exercises 2-3x per week (mon/wed/fri). ",Could you refer me to any resources to read up on this? Im interested if theres any merit in what he said. Usually he is pretty knowledgeable.,False,neutral,[],neutral,yes,"['neutral', 'neutral', 'empowering']"
relationships,man,There is no alongside regular medicine.  There is medicine and then there is quackery.  If theyre seeing qualified professionals theres no reason to add extra time and money spent on talking to snakeoil salesmen.,Thank you.  <link>,False,empowering,[],neutral,no,"['empowering', 'neutral', 'empowering']"
relationships,woman,"There is no way in hell you should considering giving them one cent of your inheritance. Do what you can to convince your wife, but if you arent able to make her understand your reasoning, it may be necessary to put the money in an account that she cant access without your signature. ","Im amazed none of the higher-up comments are saying this. OP, do something **immediately** to ensure that your wife is locked out of that money. Theres no need for her to access it right now anyway, so make sure its sealed tight so she cant go behind your back and give it all to her family.",False,empowering,"['assertive', 'decision', 'emotion']",agree,no,"['empowering', 'empowering', 'empowering']"
teenagers,woman,There is nothing in the world that is going to make me sing fancy.,Pleaaaaade. Ill do anything lol,False,disempowering,[],No Consensus,no,"['disempowering', 'disempowering', 'empowering']"
relationships,woman,"There is nothing wrong with guiding her in the direction you want I really like when you _____, Maybe you could try ___ I think it would be really hot if you ___ You can help show her what you want with out making her feel bad about her skills, it doesnt have to be one or the other. Maybe ask on /r/sex as well?",>Maybe ask on /r/sex as well?  I hope im not on the wrong sub. I didnt even think about it.,True,empowering,"['assertive', 'emotion']",neutral,no,"['empowering', 'empowering', 'empowering']"
relationships,woman,There is nothing wrong with this. Your mom trusts you to make the right decisions and it seems like shes given you the guidance and support that you have needed. She probably recognizes the stress you put on yourself and relaxes a little bit. Its great that you have such an excellent relationship with your mom.,Thank you so much! I honestly feel blessed that she doesnt put lots of stress on me about uni because its stressful enough as it is! Thank you for quelling my fears.,True,empowering,"['emotion', 'positive']",agree,no,"['empowering', 'empowering', 'empowering']"
teenagers,woman,There was the west palm beach warp tour and Im sad I couldnt go.,I totally forgot about warped this year until I saw all the pictures on FB today. x.x,False,empowering,['alone'],neutral,no,"['neutral', 'empowering', 'empowering']"
AskReddit,man,Theres a web site for that!  Link,Im glad someone else uses this.,False,neutral,[],agree,no,"['neutral', 'empowering', 'neutral']"
AskReddit,woman,"Theres also chicks and dudes. I dont really know if these are exclusive to different regions. Funny thing is, Ive been addressed as dude many times before, mostly by other girls, and I am very obviously a girl. Ive never been called a chick.","To be fair, dude has pretty much become gender neutral by now. Same with guys. Girls can be addressed as dude or called guys when in a group, but we just cant be called a dude or a guy.",False,neutral,[],agree,no,"['neutral', 'neutral', 'neutral']"
relationships,woman,"Theres nothing wrong with sacrificing it. But theres also nothing wrong with having it be important to you. I would approach it override of a sexual situation, and ask her how she feels about it. Also communicate how much you love it and love it from her specifically, but let her know that you want to know her Honest feelings about it.",">Theres nothing wrong with sacrificing it. But theres also nothing wrong with having it be important to you  Thanks that makes me feel comfortable making these decisions without feeling like a shitty person one way or another. my dad always used to say No decision can make you a bad person unless you feel bad about it, and if you feel bad about it, then you probably need to apologize",True,empowering,"['emotion', 'assertive']",agree,no,"['empowering', 'empowering', 'empowering']"
teenagers,man,Theres some at my school. Not enough though. One day well both have the experience.,"Really? I go to a school of about 3700, and there are like 2.",False,neutral,[],neutral,no,"['neutral', 'neutral', 'neutral']"
AskReddit,man,These are some of the main reasons I gave up facebook.  Im astounded by how gullible some people are.,The crazy thing is how easy it is to debunk all of it...whether it is a quote from a historical figure or some statistic they are simply made up 90% of the time.  Then if you point it out to them they act like you are a dick.,False,No Consensus,['critically'],agree,no,"['disempowering', 'neutral', 'empowering']"
Fitness,man,"They are and I am adding weight, but apparently I still have chicken legs (read: calves)","do them slowly, especially the negatives. Its very easy to cheat a calve raise",False,neutral,[],neutral,yes,"['neutral', 'neutral', 'disempowering']"
AskReddit,man,They are mentally ill and need some type of help,Such as?,False,disempowering,['others'],neutral,no,"['disempowering', 'disempowering', 'neutral']"
AskReddit,man,"They arent Really looking for them. Most people I knew thought it was the Step father and his friends, but dont formally have anything. I doubt they ever convict anyone else because of the Alford Plea. It was a redneck witch hunt and no one won.","Im glad they took the Alford plea, because otherwise Damien would probably be dead now, but its just awful that they consider the case closed.    People that are pro-death penalty say oh, these cases are so rare, innocent people dont get executed.  This is just one example where it could happened.",False,neutral,[],neutral,no,"['neutral', 'neutral', 'neutral']"
AskReddit,woman,They still have the names of the brands on them in Arial or Helvetica or some font like that.,> Helvetica  Real gore right here.  *Give me one with a torn-in-half baby. No Comic Sans please.*,False,neutral,[],neutral,no,"['neutral', 'neutral', 'neutral']"
teenagers,woman,Theyre amazing! I saw them live 2 years ago and it was the best!,Meh Im jealous :L,True,neutral,[],neutral,no,"['empowering', 'neutral', 'neutral']"
Fitness,man,Theyre crazy hard and my progression with them has been slow.,If its too hard it means the weight is too heavy. You cant do this exercise properly with heavy weight,True,disempowering,[],neutral,no,"['disempowering', 'disempowering', 'neutral']"
relationships,woman,Think she could get part time work w/ a local dog walker instead?,Dog walkers arent really a thing where we live.,True,neutral,[],neutral,no,"['neutral', 'neutral', 'neutral']"
AskReddit,woman,This a really lovely thing to do :)  I hope you guys have a happy life together.,Thank you very much! :) I hope so too haha,True,empowering,[],agree,no,"['empowering', 'empowering', 'neutral']"
Fitness,man,"This gives me a bit of hope, glad its going well for you! I personally went from 330lbs down to 277lbs from a month of strict dieting. About 8 months of.. nothing, Im at 317lbs.. fairly sad Ive let myself do this so far.","Dont get discouraged, get motivated. You did it once, now do it again. You got this. ",True,empowering,"['changes', 'grow']",agree,yes,"['disempowering', 'empowering', 'empowering']"
Fitness,woman,"This got me to google hip opener yoga poses and theyve alleviated the pain for the time being, starting with that pigeon pose. Wow. Thank you for that!!","Sure thing. My hips will tighten up for no reason. Started doing lots of pigeon pose in crossfit, its a game changer.",True,empowering,[],agree,no,"['empowering', 'empowering', 'empowering']"
relationships,woman,This is a great reply. OP needs to listen to this.,Defidently listening,False,empowering,"['assertive', 'emotion']",agree,yes,"['neutral', 'empowering', 'empowering']"
AskReddit,woman,This is amazing! Im so happy for you and I hope you get to continue doing this and you continue to enjoy it! It gives me a lot of hope that one day Ill be in a career Im as passionate about as you are of yours.,I hope you do! if theres anything I can do to help feel free to PM :),True,empowering,[],agree,no,"['empowering', 'empowering', 'empowering']"
teenagers,man,This is completely normal. The only solution is to GET THE FUCK OUT OF THERE!,Hahaha. Yeah i know a few people who run for their lives as soon as the first sign of conflict arises.,False,empowering,"['assertive', 'decision', 'changes', 'emotion']",agree,no,"['empowering', 'empowering', 'empowering']"
Fitness,man,This is great advice. Congratulations on breaking 5 miles in 25 minutes.  I might have to try out some of your advice. Im currently hitting 6 miles in 40 minutes and am hoping to drop that to 30 minutes for my next goal.,Good god. Thats close to a 15 minute 5k.,True,empowering,"['changes', 'positive']",agree,no,"['empowering', 'empowering', 'empowering']"
relationships,woman,"This is nowhere near heading in the right direction if hes lying that the ring cost a pretty penny, hes not even honest about it. A $10 ring, and lying about the price, is not committing to her or showing any sincerity or any improvement. ","Fair point, I must have missed that :/",False,No Consensus,[],agree,no,"['empowering', 'neutral', 'disempowering']"
teenagers,man,"This is pure cringe and amazingness at the same time. Ive been feeling kinda down today but now I feel pretty good. Thanks!  Also dont lie to me, I know you were dancing along while you sang as well.",Just a bit of dancing ;-),True,empowering,"['true', 'emotion']",agree,no,"['empowering', 'empowering', 'empowering']"
AskReddit,woman,"This is really an interesting perspective. At the same time Im not sure Id feel comfortable. A lot of the time its from someone just walking by, and Ive had someone stop in their tracks and turn around and follow me just because I gave them a friendly smile. Where I live theres no guarantee of safety, theres no guarantee of sanity, and theres no guarantee that if I make eye contact with someone they wont follow me home (its happened).","Yea...I totally understand.....thats why I said you would need to have an easy escape.  Preferrably a fool proof one, because if your like me the bus door would slam shut right before you got on or something like that.  Ideally though you want to give these guys the impression that they WOULD have had a chance had they approached you like a human being....but you dont want to actually give them that chance....LOL",False,empowering,['critically'],agree,no,"['empowering', 'empowering', 'empowering']"
teenagers,woman,"This is really important. No means no. Yes means yes. If she isnt enthusiastic, ask.",I agree. But its a shame most view sex differently from men.,True,empowering,[],agree,no,"['empowering', 'neutral', 'empowering']"
relationships,woman,"This is so sad. You did the right thing by blocking them. Im glad you had time with your birth mother, especially after losing your mom at such a young age. ","Linda was great. It was nice to see where I go some of my quirks that I didnt get from Mom. She also really love books, so we shared a lot of our reading lists with one another. It was really nice. ",True,empowering,['emotion'],agree,no,"['empowering', 'empowering', 'empowering']"
teenagers,man,"This is the only pic Ive ever shown of me on this sub, for this exact reason haha  <link>  Tall dude in the middle FYI",thats a pretty dress,False,No Consensus,[],No Consensus,no,"['neutral', 'empowering', 'disempowering']"
AskReddit,man,"This is what I am coming to understand. Mainly it seems to be Mediterranian countries, and a few that border them, but mainly South and West. I am still not sure about the countries that used to be Yugoslavia, though.","Yes, youve got it right :)",False,neutral,[],agree,no,"['neutral', 'neutral', 'empowering']"
teenagers,man,This is what I am hoping happens...,Niceeeee,False,empowering,[],agree,no,"['neutral', 'empowering', 'empowering']"
CasualConversation,man,This made me smile tx,Aw :)  Your flair made me feel energetic! :D,False,empowering,[],agree,no,"['empowering', 'empowering', 'neutral']"
CasualConversation,man,"This might sound weird, but go for a walk and actively notice the beautiful things around you - sights, sounds, people, etc. Concentrate on being in the moment and enjoying your experience. Youre basically training your brain to feel good about whats going on.",I have the day off work today so Im thinking I might go do that!,True,empowering,"['changes', 'competency', 'grow', 'options']",agree,no,"['empowering', 'empowering', 'empowering']"
CasualConversation,woman,"This must have been terrifying. When I was a lifeguard I absolutely dreaded the idea of even the possibility of having to perform cpr on anyone. Im glad everything turned out ok and I want you to know that even though we dont know each other, Im proud of you!","It was, but only afterwards. Thanks for your kind proudness...is that even a word?! :-)",True,empowering,['positive'],agree,no,"['empowering', 'disempowering', 'empowering']"
AskReddit,man,"This post should get attention along with the Its a trap! ones. Theres nothing wrong with giving out your paypal address (since you have a good password and non-obvious answers to your security questions, right?) and if you get and verify the money, then send this guy your camera!","Alright everyone, thanks so much for the quick replies, I shall proceed with caution.",False,empowering,[],neutral,no,"['empowering', 'neutral', 'empowering']"
teenagers,man,This post was sponsored by Qualcomm. Get a Snapdragon modem in your next device. Click here to learn more.,Fuck,True,neutral,[],disagree,no,"['neutral', 'neutral', 'disempowering']"
relationships,woman,This reminds me of the MIL who slapped the identical twin of a cheater in a movie theater. This sub comes full circle.,I remember that. And the guy did nothing. What a fucking joke.,False,neutral,[],neutral,no,"['neutral', 'neutral', 'neutral']"
Fitness,man,This seems like a decent article... I would try some dynamic stretching while youre warming up and then incorporate some static stretching during the evenings... and maybe some yoga too.   Make sure to stop by /r/StrongLifs5x5... good luck!,Thanks for your help. That article was exactly the kind of thing I was after. I wasnt getting much result with just trying to touch my toes. Hopefully this helps.,True,empowering,[],agree,no,"['empowering', 'neutral', 'empowering']"
teenagers,man,"This song by Porcupine Tree flirts with metal and it has a downtempo kind of feel. A bit of patience is required though, its 17 minutes long.",Ill listen to it when my friend wakes up :),False,neutral,[],neutral,no,"['neutral', 'neutral', 'neutral']"
Fitness,woman,"This week was a great one for me!!  I deadlifted 1 plate finally, and I got complimented on my squat form. That last one was a huge thing for me since Im relatively new to squatting and Ive always been worried about my form and hitting depth, so it was great to have positive reinforcement.  I also got complimented on lifting so much (for a girl) on my 1 plate deadlift by the local gym creeper, but hey, at least someone is mirin my baby gains....",Last part made me laugh. Keep it up!,True,empowering,"['changes', 'emotion']",agree,no,"['neutral', 'empowering', 'empowering']"
Fitness,man,Those who say they dont have time for exercise will damn sure have to make time when they fall ill due to lack of exercise.,Theyre too busy watching their tv shows.,False,No Consensus,[],No Consensus,No Consensus,"['disempowering', 'neutral']"
relationships,woman,Those women are not going to talk about this with their husbands.  thats the last thing theyd want.,They might tell OPs husband is what I meant,False,empowering,['emotion'],neutral,no,"['empowering', 'empowering', 'neutral']"
CasualConversation,man,"Though this is not something really exciting, Im just really happy about how well Im doing at uni. I put a lot of hours into studying and working on various assignments, and Im just so thankful that its paying off.   For some reason, I feel almost bad or embarrassed about telling my friends about how well Im doing, mostly because I know some of them arent doing so well and I dont really want to come across as bragging or rubbing it in. But at least I can be proud of it!",Good to hear its paying off. ^_^ What are you studying?,True,No Consensus,"['positive', 'skill']",agree,no,"['neutral', 'empowering', 'disempowering']"
relationships,woman,"Tip: to cut down on moving costs, rent a truck to drive yourself and just hire movers to load and unload.  (Just dont hire them through the U-Haul website.)","I really dont think I can drive a uhaul myself honestly. Id have to beg a relative to come help, but I have no family near me, so that is unlikely. I am terrible at driving large vehicles in general. I for sure would crash lol.",True,disempowering,[],disagree,yes,"['disempowering', 'disempowering', 'empowering']"
AskReddit,man,Tl;dr rich white people everywhere,Long Island.,False,neutral,[],neutral,no,"['neutral', 'neutral', 'neutral']"
AskReddit,woman,"To add onto what bluefox said, if you do see a therapist (or just talk to anyone else) consider writing what is on your mind down beforehand. When I had a depression and decided to go to my doctor I had the same problem as you that the moment I wanted to talk about I instantly forgot what I had to say. Wouldve saved a lot of trouble if I had just written it down. Best of luck to you! ","I havent legitimately written my thoughts down or journaled in a while. I used to a year or so ago, but it got a little obsessive. Ive actually been meaning to get back into it, but with more discipline. ",True,empowering,[],agree,no,"['empowering', 'empowering', 'empowering']"
CasualConversation,man,"To be fair, I never lose my ability to write sentences when Im drunk. He *could* be stumbling around in an alley somewhere for all we know!",Hahaha! That made me sharply exhale air through my nose!,False,neutral,[],neutral,no,"['neutral', 'neutral', 'neutral']"
Fitness,man,"To be fair, fitness means different things to everyone; not everyone wants to be strong.","ok, maybe it was a little hyperbole, but Im pretty sure you know what I meant.",False,No Consensus,[],No Consensus,no,"['disempowering', 'empowering', 'neutral']"
CasualConversation,man,"To be fair, like 80% of Denmark is on the coast. You have to work to be more than an hour away...",I think the furthest you can be here is 150km,False,neutral,[],neutral,no,"['neutral', 'neutral', 'neutral']"
Fitness,man,To each his own I guess. I love the flow and overall look of a v-taper. Been contemplating on whether I should do or not do obliques for months lol,"I mean, would you purposefully keep yourself weaker than you could be? ",True,neutral,[],disagree,yes,"['neutral', 'empowering', 'neutral']"
Fitness,man,"Today was leg day and I was wondering my squats were suddenly becoming so difficult. It was only as I focused on the number of reps that I was counting and had bypassed five and was on squat number nine. No wonder it was hard, I should have stopped four reps ago!",Were you distracted by the guy using the lat bar for forearm curls?,False,disempowering,['emotion'],neutral,yes,"['disempowering', 'neutral', 'disempowering']"
